{
  "id": "wsdot-station-sr-539-sr-544-interchange-pole-rd-at-mp-7-51-3833",
  "name": "SR 539 / SR 544 Interchange (Pole Rd) at mp 7.51",
  "lat": 48.891981,
  "lon": -122.48569,
  "kind": "station",
  "provider": "wsdot-weather",
  "provider_ref": "3833",
  "source": "WSDOT",
  "page_url": "https://wsdot.com/travel/real-time/map/",
  "requires_key": "WSDOT_CODE",
  "status": "approved",
  "approved_by": "codingwithchad",
  "tags": [],
  "attribution_text": "Washington State Department of Transportation",
  "created_at": "2026-10-07T00:00:00Z"
}
