{
  "id": "wsdot-station-zillah-on-i-82-at-mp-54-08-3113",
  "name": "Zillah on I-82 at mp 54.08",
  "lat": 46.393,
  "lon": -120.2411,
  "kind": "station",
  "provider": "wsdot-weather",
  "provider_ref": "3113",
  "source": "WSDOT",
  "page_url": "https://wsdot.com/travel/real-time/map/",
  "requires_key": "WSDOT_CODE",
  "status": "approved",
  "approved_by": "codingwithchad",
  "tags": [],
  "attribution_text": "Washington State Department of Transportation",
  "created_at": "2026-10-07T00:00:00Z"
}
