{
  "id": "nws-forecast-airfield-friday-harbor-airport",
  "name": "Friday Harbor Airport forecast",
  "lat": 48.5219,
  "lon": -123.0242,
  "kind": "forecast",
  "provider": "nws",
  "provider_ref": "48.5219,-123.0242",
  "source": "National Weather Service",
  "page_url": "https://forecast.weather.gov/MapClick.php?lat=48.5219&lon=-123.0242",
  "status": "approved",
  "approved_by": "codingwithchad",
  "attribution_text": "National Weather Service",
  "tags": [
    "airfield"
  ],
  "created_at": "2026-10-07T00:00:00Z"
}
