{
  "id": "wsdot-station-diamond-point-on-us-101-at-mp-274-60-2044",
  "name": "Diamond Point on US 101 at mp 274.60",
  "lat": 48.0504,
  "lon": -122.9523,
  "kind": "station",
  "provider": "wsdot-weather",
  "provider_ref": "2044",
  "source": "WSDOT",
  "page_url": "https://wsdot.com/travel/real-time/map/",
  "requires_key": "WSDOT_CODE",
  "status": "approved",
  "approved_by": "codingwithchad",
  "tags": [],
  "attribution_text": "Washington State Department of Transportation",
  "created_at": "2026-10-07T00:00:00Z"
}
