{
  "id": "wsdot-station-snoqualmie-river-bridge-on-i-90-at-mp-37-75-2068",
  "name": "Snoqualmie River Bridge on I-90 at mp 37.75",
  "lat": 47.4435,
  "lon": -121.6694,
  "kind": "station",
  "provider": "wsdot-weather",
  "provider_ref": "2068",
  "source": "WSDOT",
  "page_url": "https://wsdot.com/travel/real-time/map/",
  "requires_key": "WSDOT_CODE",
  "status": "approved",
  "approved_by": "codingwithchad",
  "tags": [
    "i-90"
  ],
  "attribution_text": "Washington State Department of Transportation",
  "created_at": "2026-10-07T00:00:00Z"
}
