{
  "id": "wsdot-station-tanner-crossing-on-wb-i-90-at-mp-33-50-2069",
  "name": "Tanner Crossing on WB I-90 at mp 33.50",
  "lat": 47.473,
  "lon": -121.742,
  "kind": "station",
  "provider": "wsdot-weather",
  "provider_ref": "2069",
  "source": "WSDOT",
  "page_url": "https://wsdot.com/travel/real-time/map/",
  "requires_key": "WSDOT_CODE",
  "status": "approved",
  "approved_by": "codingwithchad",
  "tags": [
    "i-90"
  ],
  "attribution_text": "Washington State Department of Transportation",
  "created_at": "2026-10-07T00:00:00Z"
}
