{
  "id": "wsdot-station-c-st-sw-in-auburn-on-sr-18-at-mp-3-68-3277",
  "name": "C St SW in Auburn on SR 18 at mp 3.68",
  "lat": 47.303516,
  "lon": -122.232946,
  "kind": "station",
  "provider": "wsdot-weather",
  "provider_ref": "3277",
  "source": "WSDOT",
  "page_url": "https://wsdot.com/travel/real-time/map/",
  "requires_key": "WSDOT_CODE",
  "status": "approved",
  "approved_by": "codingwithchad",
  "tags": [],
  "attribution_text": "Washington State Department of Transportation",
  "created_at": "2026-10-07T00:00:00Z"
}
