{
  "id": "wsdot-station-seibert-creek-bridge-on-us-101-at-mp-256-2045",
  "name": "Seibert Creek Bridge on US 101 at mp 256",
  "lat": 48.0938,
  "lon": -123.2783,
  "kind": "station",
  "provider": "wsdot-weather",
  "provider_ref": "2045",
  "source": "WSDOT",
  "page_url": "https://wsdot.com/travel/real-time/map/",
  "requires_key": "WSDOT_CODE",
  "status": "approved",
  "approved_by": "codingwithchad",
  "tags": [],
  "attribution_text": "Washington State Department of Transportation",
  "created_at": "2026-10-07T00:00:00Z"
}
