{
  "id": "wsdot-station-manastash-ridge-westbound-on-i-82-at-mp-3-75-1978",
  "name": "Manastash Ridge Westbound on I-82 at mp 3.75",
  "lat": 46.928,
  "lon": -120.5,
  "kind": "station",
  "provider": "wsdot-weather",
  "provider_ref": "1978",
  "source": "WSDOT",
  "page_url": "https://wsdot.com/travel/real-time/map/",
  "requires_key": "WSDOT_CODE",
  "status": "approved",
  "approved_by": "codingwithchad",
  "tags": [],
  "attribution_text": "Washington State Department of Transportation",
  "created_at": "2026-10-07T00:00:00Z"
}
