{
  "id": "wsdot-station-mid-hanford-on-sr-240-at-mp-12-31-3274",
  "name": "Mid Hanford on SR 240 at mp 12.31",
  "lat": 46.467063,
  "lon": -119.541111,
  "kind": "station",
  "provider": "wsdot-weather",
  "provider_ref": "3274",
  "source": "WSDOT",
  "page_url": "https://wsdot.com/travel/real-time/map/",
  "requires_key": "WSDOT_CODE",
  "status": "approved",
  "approved_by": "codingwithchad",
  "tags": [],
  "attribution_text": "Washington State Department of Transportation",
  "created_at": "2026-10-07T00:00:00Z"
}
